{
  "version": 1,
  "experiment_id": "synthetic-tutorial",
  "study_phase": "orchestration",
  "policy_revision": "tutorial-policy-v1",
  "data_kind": "synthetic",
  "runs": [
    {
      "id": "single-1",
      "case_id": "contract-fixture",
      "arm": "single",
      "repetition": 1,
      "revision": "synthetic-fixture-v1",
      "host": "tutorial-host",
      "model": "tutorial-model",
      "effort": "default",
      "outcome": "accepted",
      "wall_seconds": 100,
      "tokens": 1000,
      "api_cost_usd": 0.1,
      "evidence": "Synthetic tutorial values; no model execution or performance gain is claimed."
    },
    {
      "id": "fixed-1",
      "case_id": "contract-fixture",
      "arm": "fixed",
      "repetition": 1,
      "revision": "synthetic-fixture-v1",
      "host": "tutorial-host",
      "model": "tutorial-model",
      "effort": "default",
      "outcome": "accepted",
      "wall_seconds": 120,
      "tokens": 1000,
      "api_cost_usd": 0.1,
      "evidence": "Synthetic tutorial values; no model execution or performance gain is claimed."
    },
    {
      "id": "adaptive-1",
      "case_id": "contract-fixture",
      "arm": "adaptive",
      "repetition": 1,
      "revision": "synthetic-fixture-v1",
      "host": "tutorial-host",
      "model": "tutorial-model",
      "effort": "default",
      "outcome": "accepted",
      "wall_seconds": 80,
      "tokens": 1000,
      "api_cost_usd": 0.1,
      "evidence": "Synthetic tutorial values; no model execution or performance gain is claimed."
    },
    {
      "id": "single-2",
      "case_id": "contract-fixture",
      "arm": "single",
      "repetition": 2,
      "revision": "synthetic-fixture-v1",
      "host": "tutorial-host",
      "model": "tutorial-model",
      "effort": "default",
      "outcome": "accepted",
      "wall_seconds": 100,
      "tokens": 1000,
      "api_cost_usd": 0.1,
      "evidence": "Synthetic tutorial values; no model execution or performance gain is claimed."
    },
    {
      "id": "fixed-2",
      "case_id": "contract-fixture",
      "arm": "fixed",
      "repetition": 2,
      "revision": "synthetic-fixture-v1",
      "host": "tutorial-host",
      "model": "tutorial-model",
      "effort": "default",
      "outcome": "failed",
      "wall_seconds": 120,
      "tokens": null,
      "api_cost_usd": null,
      "evidence": "Synthetic tutorial values; no model execution or performance gain is claimed."
    },
    {
      "id": "adaptive-2",
      "case_id": "contract-fixture",
      "arm": "adaptive",
      "repetition": 2,
      "revision": "synthetic-fixture-v1",
      "host": "tutorial-host",
      "model": "tutorial-model",
      "effort": "default",
      "outcome": "timeout",
      "wall_seconds": 80,
      "tokens": null,
      "api_cost_usd": null,
      "evidence": "Synthetic tutorial values; no model execution or performance gain is claimed."
    }
  ]
}
